{
  "version": 1,
  "id": "fuzz-trunc-035",
  "title": "Fuzz Truncation len=41",
  "category": "fuzz",
  "input": {
    "encoding": "utf8-text",
    "data": "{\"a\":[1,2,3,4,5],\"b\":{\"c\":\"hello\",\"d\":\"wo"
  },
  "stream": {
    "endReason": "length",
    "chunkStrategies": [
      "single",
      "byte-per-chunk"
    ]
  },
  "expected": {
    "syntax": "incomplete",
    "outcome": "truncated",
    "executable": false,
    "diagnostics": [
      {
        "code": "E_STREAM_TRUNCATED",
        "severity": "error",
        "recoverable": false
      }
    ],
    "repairs": [],
    "events": []
  },
  "provenance": {
    "source": "synthetic"
  }
}