{
  "version": 1,
  "id": "openrouter-58",
  "title": "Provider Fixture openrouter-58",
  "category": "openrouter",
  "provider": "openrouter",
  "input": {
    "encoding": "utf8-text",
    "data": "{\"choices\":[{\"delta\":{\"tool_calls\":[{\"index\":0,\"id\":\"call_9\",\"type\":\"function\",\"function\":{\"name\":\"foo\"}}]},\"index\":0}]}\\n{\"choices\":[{\"delta\":{\"tool_calls\":[{\"index\":0,\"function\":{\"arguments\":\"{\\\"e\\\":9}\"}}]},\"index\":0}]}\\n{\"choices\":[{\"finish_reason\":\"tool_calls\",\"index\":0}]}"
  },
  "stream": {
    "endReason": "complete",
    "chunkStrategies": [
      "line-per-chunk"
    ]
  },
  "expected": {
    "syntax": "root_complete",
    "outcome": "valid",
    "executable": true,
    "diagnostics": [],
    "repairs": [],
    "events": [
      {
        "type": "tool_call_start",
        "sequence": 1,
        "provider": "openrouter",
        "callRef": {
          "sourceKey": "choice:0/tool-index:0"
        },
        "toolIndex": 0,
        "toolCallId": "call_9",
        "name": "foo"
      },
      {
        "type": "tool_call_arguments_delta",
        "sequence": 2,
        "provider": "openrouter",
        "callRef": {
          "sourceKey": "choice:0/tool-index:0"
        },
        "delta": "{\"e\":9}"
      },
      {
        "type": "tool_call_end",
        "sequence": 3,
        "provider": "openrouter",
        "callRef": {
          "sourceKey": "choice:0/tool-index:0"
        },
        "reason": "complete",
        "providerReason": "tool_calls"
      },
      {
        "type": "provider_stream_end",
        "sequence": 4,
        "provider": "openrouter",
        "reason": "complete",
        "providerReason": "tool_calls"
      }
    ]
  },
  "provenance": {
    "source": "synthetic"
  }
}
