{
  "version": 1,
  "id": "fuzz-depth-020",
  "title": "Fuzz Depth 75",
  "category": "fuzz",
  "input": {
    "encoding": "utf8-text",
    "data": "{\"k\":{\"k\":{\"k\":{\"k\":{\"k\":{\"k\":{\"k\":{\"k\":{\"k\":{\"k\":{\"k\":{\"k\":{\"k\":{\"k\":{\"k\":{\"k\":{\"k\":{\"k\":{\"k\":{\"k\":{\"k\":{\"k\":{\"k\":{\"k\":{\"k\":{\"k\":{\"k\":{\"k\":{\"k\":{\"k\":{\"k\":{\"k\":{\"k\":{\"k\":{\"k\":{\"k\":{\"k\":{\"k\":{\"k\":{\"k\":{\"k\":{\"k\":{\"k\":{\"k\":{\"k\":{\"k\":{\"k\":{\"k\":{\"k\":{\"k\":{\"k\":{\"k\":{\"k\":{\"k\":{\"k\":{\"k\":{\"k\":{\"k\":{\"k\":{\"k\":{\"k\":{\"k\":{\"k\":{\"k\":{\"k\":{\"k\":{\"k\":{\"k\":{\"k\":{\"k\":{\"k\":{\"k\":{\"k\":{\"k\":{\"k\":{}}}}}}}}}}}}}}}}}}}}}}}}}}}}}}}}}}}}}}}}}}}}}}}}}}}}}}}}}}}}}}}}}}}}}}}}}}}}"
  },
  "stream": {
    "endReason": "complete",
    "chunkStrategies": [
      "single"
    ]
  },
  "expected": {
    "syntax": "root_complete",
    "outcome": "valid",
    "executable": true,
    "diagnostics": [],
    "repairs": [],
    "events": []
  },
  "provenance": {
    "source": "synthetic"
  }
}