{
  "version": 1,
  "id": "gemini-42",
  "title": "Provider Fixture gemini-42",
  "category": "gemini",
  "provider": "gemini",
  "input": {
    "encoding": "utf8-text",
    "data": "{\"candidates\":[{\"content\":{\"parts\":[{\"functionCall\":{\"name\":\"foo\",\"args\":{\"d\":5}}}]}}]}"
  },
  "stream": {
    "endReason": "complete",
    "chunkStrategies": [
      "line-per-chunk"
    ]
  },
  "expected": {
    "syntax": "root_complete",
    "outcome": "valid",
    "executable": false,
    "diagnostics": [
      {
        "code": "E_ARGUMENT_EVIDENCE_PROJECTION_ONLY",
        "severity": "warning",
        "recoverable": false
      }
    ],
    "repairs": [],
    "events": [
      {
        "type": "tool_call_start",
        "sequence": 1,
        "provider": "gemini",
        "callRef": {
          "sourceKey": "candidate:0/part:0"
        },
        "name": "foo"
      },
      {
        "type": "provider_diagnostic",
        "sequence": 2,
        "provider": "gemini",
        "callRef": {
          "sourceKey": "candidate:0/part:0"
        },
        "code": "E_ARGUMENT_EVIDENCE_PROJECTION_ONLY",
        "severity": "warning",
        "message": "Gemini function-call arguments are a structured projection, not raw streamed argument evidence"
      },
      {
        "type": "tool_call_arguments_delta",
        "sequence": 3,
        "provider": "gemini",
        "callRef": {
          "sourceKey": "candidate:0/part:0"
        },
        "delta": "{\"d\":5}"
      },
      {
        "type": "tool_call_end",
        "sequence": 4,
        "provider": "gemini",
        "callRef": {
          "sourceKey": "candidate:0/part:0"
        },
        "reason": "complete"
      },
      {
        "type": "provider_stream_end",
        "sequence": 5,
        "provider": "gemini",
        "reason": "complete"
      }
    ]
  },
  "provenance": {
    "source": "synthetic"
  }
}
