{
  "version": 1,
  "id": "canonical-container-002",
  "title": "Unclosed array",
  "category": "canonical",
  "input": {
    "encoding": "utf8-text",
    "data": "{\"items\":[1,2,3"
  },
  "stream": {
    "endReason": "length",
    "chunkStrategies": [
      "single",
      "byte-per-chunk",
      "char-per-chunk"
    ]
  },
  "expected": {
    "syntax": "incomplete",
    "outcome": "truncated",
    "stableValue": {},
    "finalValue": {},
    "executable": false,
    "diagnostics": [
      {
        "code": "E_INCOMPLETE_NUMBER",
        "severity": "error",
        "recoverable": false
      },
      {
        "code": "E_STREAM_TRUNCATED",
        "severity": "error",
        "recoverable": false
      }
    ],
    "repairs": [],
    "events": []
  },
  "provenance": {
    "source": "synthetic"
  }
}