{
  "version": 1,
  "id": "canonical-number-001",
  "title": "Numbers in object",
  "category": "canonical",
  "input": {
    "encoding": "utf8-text",
    "data": "{\"x\":42,\"y\":100}"
  },
  "stream": {
    "endReason": "complete",
    "chunkStrategies": [
      "single",
      "byte-per-chunk",
      "char-per-chunk"
    ]
  },
  "expected": {
    "syntax": "root_complete",
    "outcome": "valid",
    "stableValue": {
      "x": 42,
      "y": 100
    },
    "finalValue": {
      "x": 42,
      "y": 100
    },
    "executable": true,
    "diagnostics": [],
    "repairs": [],
    "events": []
  },
  "provenance": {
    "source": "synthetic"
  }
}