{
  "version": 1,
  "id": "fuzz-trunc-027",
  "title": "Fuzz Truncation len=5",
  "category": "fuzz",
  "input": {
    "encoding": "utf8-text",
    "data": "{\"a\":"
  },
  "stream": {
    "endReason": "length",
    "chunkStrategies": [
      "single",
      "byte-per-chunk"
    ]
  },
  "expected": {
    "syntax": "incomplete",
    "outcome": "truncated",
    "executable": false,
    "diagnostics": [
      {
        "code": "E_STREAM_TRUNCATED",
        "severity": "error",
        "recoverable": false
      }
    ],
    "repairs": [],
    "events": []
  },
  "provenance": {
    "source": "synthetic"
  }
}